[
  {
    "id": "Juan_Vicente_Herrera_Ruiz_de_Alejo",
    "slug": "juan-vicente-herrera-ruiz-de-alejo",
    "name": "Juan Vicente Herrera Ruiz de Alejo",
    "bio": "Juan Vicente Herrera, Cloud Architect en Red Hat y co-organizador de Madrid DevOps y DevOpsdays Madrid, dará la bienvenida oficial a todos los asistentes de la X-Ops Conference Madrid 2025. En este keynote general del evento, presentará la visión de la conferencia, destacará las tendencias más importantes en el ecosistema X-Ops y establecerá el contexto para las sesiones que seguirán durante los dos días del evento.",
    "photoUrl": "https://xopsconference.com/images/speakers/juan-vicente-herrera-ruiz-de-alejo.jpg",
    "socials": [],
    "updatedAt": "2025-11-04T10:54:02.404Z",
    "version": "1.0"
  },
  {
    "id": "Luis_Guirigay",
    "slug": "luis-guirigay",
    "name": "Luis Guirigay",
    "bio": "En este keynote, Luis Guirigay, Worldwide Head of Cloud Infrastructure Solutions en AWS, presentará oficialmente el track exclusivo dedicado a AWS en la X-Ops Conference Madrid 2025. Este track especial cuenta con ingenieros de AWS, AWS Community Builders y AWS Heroes en la lista de ponentes, ofreciendo una experiencia única y especializada.",
    "photoUrl": "https://xopsconference.com/images/speakers/luis-guirigay.jpg",
    "socials": [],
    "updatedAt": "2025-11-04T10:54:02.404Z",
    "version": "1.0"
  },
  {
    "id": "Shani_Adadi_Kazaz",
    "slug": "shani-adadi-kazaz",
    "name": "Shani Adadi Kazaz",
    "bio": "Discover how leveraging Kubernetes for platform engineering can dramatically increase development efficiency, streamline operations, and enable unprecedented scale through Kubernetes-native GitOps. This session explores how the Kubernetes API becomes the cornerstone of GitOps practices, solving key challenges in managing cloud resources and infrastructure at scale. Learn how this Kubernetes-centric approach transforms traditional workflows, allowing teams to declaratively manage thousands of resources across complex environments using familiar Kubernetes objects and methodologies. We'll demonstrate how platform abstractions help overcome complex challenges, and how automation aligns with Kubernetes controllers principles using open-source tools. Explore how the powerful combination of Kro, ArgoCD, and ACK extends the Kubernetes API to drive GitOps for both applications and infrastructure, revolutionizing platform engineering on EKS through a truly Kubernetes-native GitOps approach.",
    "photoUrl": "https://xopsconference.com/images/speakers/shani-adadi-kazaz.jpg",
    "socials": [],
    "updatedAt": "2025-11-04T10:54:02.404Z",
    "version": "1.0"
  },
  {
    "id": "Gisela_Torres",
    "slug": "gisela-torres",
    "name": "Gisela Torres",
    "bio": "¿Y si te dijera que hay una forma de liberar a los equipos del caos operativo y además self-service?\n\nEn esta charla exploraremos qué es Platform Engineering, por qué está transformando la forma en que trabajamos con la infraestructura, templates, repos, configuraciones, etc. y cómo puede ser el cambio que tu organización necesita. Te mostraré un caso práctico que ilustra cómo sería nuestro día a día si adoptáramos esta práctica: más foco en el producto, menos fricción y una colaboración mucho más fluida entre equipos. Spoiler: después de esto, no querrás volver atrás.",
    "photoUrl": "https://xopsconference.com/images/speakers/gisela-torres.jpg",
    "socials": [],
    "updatedAt": "2025-11-04T10:54:02.404Z",
    "version": "1.0"
  },
  {
    "id": "Alejandro_de_la_Hoz_Martin",
    "slug": "alejandro-de-la-hoz-martin",
    "name": "Alejandro de la Hoz Martin",
    "bio": "Desarrollando un CICD de un servicio de automatización en AWX. Desde el push del desarrollador hasta la publicación del JobTemplate en AWX para ser lanzado via APIRest, incluyendo por el camino linters, test y firma del mismo.",
    "photoUrl": "https://xopsconference.com/images/speakers/alejandro-de-la-hoz-martin.jpg",
    "socials": [],
    "updatedAt": "2025-11-04T10:54:02.404Z",
    "version": "1.0"
  },
  {
    "id": "Alberto_Morgante",
    "slug": "alberto-morgante",
    "name": "Alberto Morgante",
    "bio": "As Kubernetes adoption grows beyond the cloud into data centers and edge environments, provisioning clusters on bare metal becomes increasingly crucial. However, deploying and managing these environments at scale remains a complex challenge.\n\nThis session will explore how Cluster API (CAPI) combined with ClusterClass can be leveraged to fully automate the lifecycle of Kubernetes clusters on bare metal infrastructure. Attendees will learn how to eliminate manual provisioning, enforce cluster consistency, and reduce operational toil using modern GitOps-driven workflows.\n\nWe'll walk through a real-world, end-to-end implementation that includes:\n\nSetting up a CAPI provider for bare metal (e.g., Metal3)\n\nUsing ClusterClass to define standardized cluster templates\n\nIntegrating with Ironic for node provisioning\n\nAutomating updates, scaling, and lifecycle management\n\nBest practices for security, HA, and extensibility in bare metal scenarios\n\nWhether you're operating edge clusters, hybrid environments, or building your own metal cloud, this talk will give you the tools to make bare metal Kubernetes feel as dynamic and elastic as the cloud.",
    "photoUrl": "https://xopsconference.com/images/speakers/alberto-morgante.jpg",
    "socials": [],
    "updatedAt": "2025-11-04T10:54:02.404Z",
    "version": "1.0"
  },
  {
    "id": "Pablo_Sanchez_Carmona",
    "slug": "pablo-sanchez-carmona",
    "name": "Pablo Sánchez Carmona",
    "bio": "Descubre cómo adoptar una mentalidad DevSecOps transforma la protección de la infraestructura en AWS de un cuello de botella en una ventaja competitiva, permitiendo a los equipos desplegar de forma segura siendo ágiles y escalables. Esta sesión explora la intersección crítica entre automatización, infraestructura como código (IaC) y cultura DevOps en la gestión de entornos complejos. Examinaremos cómo las organizaciones gestionan exitosamente miles de recursos en AWS en entornos multi-cuenta sin sacrificar seguridad ni frenar la innovación. Exploraremos estrategias prácticas para implementar políticas como código, validación automática de requisitos de seguridad y red, y monitoreo continuo de la infraestructura. Al final de esta sesión, queremos que te lleves patrones accionables para construir infraestructura que pueda crecer de forma segura junto con tus necesidades de negocio, demostrando que seguridad y velocidad no son conceptos opuestos cuando haces \"shift left\" y \"scale right\".",
    "photoUrl": "https://xopsconference.com/images/speakers/pablo-sanchez-carmona.jpg",
    "socials": [],
    "updatedAt": "2025-11-04T10:54:02.404Z",
    "version": "1.0"
  },
  {
    "id": "Antonio_Berben_Felipe_Vicens",
    "slug": "antonio-berben-felipe-vicens",
    "name": "Antonio Berben, Felipe Vicens",
    "bio": "La inteligencia artificial ha evolucionado hacia agentes autónomos capaces de colaborar y operar a escala en infraestructura crítica.\n\nAl ver el título, tu pregunta es ineludible: ¿cómo paso de simple becario a Modo Dios de forma segura con los Agentes de AI?\n\nEsta charla desvela el camino de 0 a 100 sobre cómo es posible desplegar y escalar miles de agentes garantizando seguridad y eficiencia en infraestructuras críticas robustas\n\nCon proyectos open source como AgentGateway, Kgateway, KAgent y LLM-D como referencia, exploraremos el papel esencial de los gateways seguros y la colaboración agent-to-agent (A2A) en arquitecturas distribuidas, que permiten mantener la integridad y la protección en sistemas agénticos complejos.\n\nEntenderemos por qué la seguridad y la escalabilidad son pilares fundamentales para el futuro de los agentes autónomos en infraestructuras críticas.",
    "photoUrl": "https://xopsconference.com/images/speakers/antonio-berben-felipe-vicens.jpg",
    "socials": [],
    "updatedAt": "2025-11-04T10:54:02.404Z",
    "version": "1.0"
  },
  {
    "id": "Carlos_Villanua",
    "slug": "carlos-villanua",
    "name": "Carlos Villanúa",
    "bio": "Puede ser en Español o Inglés y puede ser de 30 minutos o 50 minutos. Será una introducción y live demo.\n\n¿Todavía expones tus APIs de forma manual, con poca seguridad ( o la seguridad en la propia API...) o siempre apagando fuegos? Esta charla es para ti.\n\nVoy a mostrarte cómo exponer APIs puede ser fácil para los equipos DevOps y seguro para los desarrolladores, usando una plataforma que es totalmente Infra as Code, sin configuraciones manuales (ClickOps), y pensada para ser rápida, segura y escalable.\n\n¿Qué vas a aprender (y por qué esto es el sueño de cualquier equipo DevOps o de plataforma)?\n\n-Infra as Code total: Todo: APIs, políticas, infraestructura y seguridad está en Git. Así puedes probar, revisar y desplegar todo automáticamente con CI/CD.\n\n-Automatización nativa en Kubernetes: Usamos herramientas como Traefik, CRDs y GitHub para hacer verdadero GitOps. Puedes desplegar, actualizar o revertir APIs sin necesidad de usar interfaces gráficas.\n\n-Seguridad flexible: OPA y Keycloak para políticas y autenticación, WAF y Content Guards para proteger tus APIs. Así los desarrolladores se enfocan en el código, no en problemas de cumplimiento.\n\n-Gateway Offloading: La plataforma se encarga de la autenticación, límites de uso, seguridad y monitoreo. Tus servicios quedan limpios y simples.\n\n-Observabilidad completa: Grafana Loki, Tempo, y Jaeger te dan visibilidad total para detectar y resolver problemas antes que los usuarios los noten.\n\nNo más excusas, no más configuraciones manuales. Solo código, automatización y tranquilidad.",
    "photoUrl": "https://xopsconference.com/images/speakers/carlos-villanua.jpg",
    "socials": [],
    "updatedAt": "2025-11-04T10:54:02.404Z",
    "version": "1.0"
  },
  {
    "id": "Mani_Ghelichkhani",
    "slug": "mani-ghelichkhani",